id,place_category,location,description,image_url,name,phone,lot_address,road_address,created_at,updated_at
18561415,음식점,SRID=4326;POINT(127.107091836512 37.4020534596082),"안녕하세요! 토속상황삼계탕입니다! 😋  
깔끔하고 맛있는 삼계탕과 다양한 닭 요리를 맛보세요!  
단체 회식이나 포장도 가능하니 언제든 편하게 방문해주세요!",https://your-storage-path/more_photo/18561415.jpg,토속상황삼계탕,031-628-6619,경기 성남시 분당구 삼평동 682,경기 성남시 분당구 대왕판교로 670,,
269932132,음식점,SRID=4326;POINT(127.109228804893 37.4021235864699),"안녕하세요! 봉피양 판교점입니다😊  
최상급 품질의 돼지갈비와 평양냉면의 환상적인 조합!  
룸에서 편안하게 식사도 즐기실 수 있으며, 주차도 편리합니다.",https://your-storage-path/more_photo/269932132.jpg,봉피양 판교점,031-737-7478,경기 성남시 분당구 삼평동 681,경기 성남시 분당구 판교역로 235,,
27352859,음식점,SRID=4326;POINT(127.099182570006 37.4029685874353),"안녕하세요! 최고야전국5대짬뽕 판교4호점입니다. 
저희는 탕수육 맛집으로, 술과 함께 즐기기 좋은 곳입니다! 
언제든 편안하게 방문해주세요!",https://your-storage-path/more_photo/27352859.jpg,최고야전국5대짬뽕 판교4호점,,경기 성남시 분당구 삼평동 617,경기 성남시 분당구 판교로227번길 6,,
21321602,음식점,SRID=4326;POINT(127.09780948982214 37.40929218945306),"안녕하세요, 청계산담백미입니다! 🥩

최상급 한우와 신선한 고기를 좋은 가격에 즐길 수 있는 곳입니다. 특히, 친절한 직원분들이 최고의 서비스를 제공해 드립니다! 가족 외식이나 회식 장소로도 제격입니다.",https://your-storage-path/more_photo/21321602.jpg,청계산담백미,031-707-0058,경기 성남시 수정구 금토동 272,경기 성남시 수정구 달래내로 22,,
21296420,음식점,SRID=4326;POINT(127.100141611187 37.4039300689882),"안녕하세요, 칭따오입니다! 😊 
맛있는 짬뽕과 탕수육, 그리고 해물볶음짜장까지! 
맛있는 중식을 칭따오에서 즐겨보세요!",https://your-storage-path/more_photo/21296420.jpg,칭따오,031-628-7750,경기 성남시 분당구 삼평동 618,경기 성남시 분당구 판교로255번길 9-22,,
998199500,음식점,SRID=4326;POINT(127.099570814162 37.4027556202632),"안녕하세요! 써브웨이 판교브릿지타워점입니다! 🥪
신선한 재료로 만든 맛있는 샌드위치를 맛보세요.
간편하게 혼밥하기에도 좋고, 경기지역화폐와 카카오페이 결제도 가능합니다!",https://your-storage-path/more_photo/998199500.jpg,써브웨이 판교브릿지타워점,031-608-1409,경기 성남시 분당구 삼평동 617,경기 성남시 분당구 판교로227번길 6,,
859737359,음식점,SRID=4326;POINT(127.110070850226 37.3971455654595),"안녕하세요! 람바다입니다! 😄 신선한 해산물로 만든 알찜과 아구찜, 얼큰한 알탕까지! 푸짐하고 맛있는 한 상 차림으로 여러분을 초대합니다!",https://your-storage-path/more_photo/859737359.jpg,람바다,031-701-3094,경기 성남시 분당구 삼평동 643,경기 성남시 분당구 판교역로 184,,
26785774,음식점,SRID=4326;POINT(127.10725295332934 37.40019450762178),"안녕하세요, 스시쿤 판교입니다! 🍣  
신선한 재료로 정성껏 준비한 오마카세, 특별한 날을 더욱 빛내줄 거예요.  
편안한 분위기에서 잊지 못할 식사 경험을 즐겨보세요!",https://your-storage-path/more_photo/26785774.jpg,스시쿤 판교,031-628-6972,경기 성남시 분당구 삼평동 670,경기 성남시 분당구 대왕판교로 660,,
15253892,음식점,SRID=4326;POINT(127.11005292325628 37.39647071707473),"안녕하세요! 크래버 대게나라 판교점입니다🦀  
신선한 대게와 랍스터를 맛보며, 특별한 날을 더욱 특별하게 만들어보세요!  
분위기 좋은 곳에서 가족, 연인과 함께 행복한 시간을 보내세요!",https://your-storage-path/more_photo/15253892.jpg,크래버 대게나라 판교점,031-8016-5593,경기 성남시 분당구 삼평동 646,경기 성남시 분당구 판교역로 178,,
2103661220,음식점,SRID=4326;POINT(127.1087627876221 37.39539068485434),"안녕하세요! 양우정 판교점입니다 😊  
고급스러운 분위기에서 신선한 한우와 양대창을 즐겨보세요!  
친절한 서비스와 넉넉한 주차 공간까지, 편안한 식사를 약속드립니다.",https://your-storage-path/more_photo/2103661220.jpg,양우정 판교점,031-706-9252,경기 성남시 분당구 백현동 531,경기 성남시 분당구 대왕판교로606번길 10,,
663836122,음식점,SRID=4326;POINT(127.1061104017132 37.40207686995042),"안녕하세요! 구우트입니다🥂  
정갈하고 맛있는 음식과 훌륭한 와인, 친절한 서비스까지!  
소중한 사람과 특별한 시간을 보내기에 완벽한 곳입니다.",https://your-storage-path/more_photo/663836122.jpg,구우트,0507-1397-0922,경기 성남시 분당구 삼평동 682,경기 성남시 분당구 대왕판교로 670,,
1185151809,음식점,SRID=4326;POINT(127.102084009388 37.4004108231145),"안녕하세요! 하림닭요리입니다 😊  
무난하게 즐길 수 있는 닭 요리와 맛있는 치킨을 맛보세요!  
점심 식사나 회식 장소로도 좋습니다.",https://your-storage-path/more_photo/1185151809.jpg,하림닭요리,031-606-8514,경기 성남시 분당구 삼평동 632,경기 성남시 분당구 대왕판교로645번길 36,,
27334535,음식점,SRID=4326;POINT(127.09521543438431 37.39985071235571),"안녕하세요! 파파존스 판교점입니다🍕  
푸짐하고 맛있는 피자를 1+1 행사로 즐겨보세요!  
친절한 직원분들이 기분 좋게 맞이해 드립니다.",https://your-storage-path/more_photo/27334535.jpg,파파존스 판교점,031-709-9492,경기 성남시 분당구 판교동 512,경기 성남시 분당구 서판교로 154,,
798065007,음식점,SRID=4326;POINT(127.106448750271 37.4009403786405),"안녕하세요! 달빛어시장 판교점입니다. 🤩  
신선한 해산물과 맛있는 회를 즐길 수 있는 곳!  
데이트나 조용한 술자리를 원하신다면 저희 달빛어시장을 찾아주세요.",https://your-storage-path/more_photo/798065007.jpg,달빛어시장 판교점,031-628-4567,경기 성남시 분당구 삼평동 670,경기 성남시 분당구 대왕판교로 660,,
24164383,음식점,SRID=4326;POINT(127.10657576809476 37.40051318032284),"안녕하세요, 버거킹 판교유스페이스점입니다! 🍔  
신선한 야채와 맛있는 소스의 조화가 일품인 버거를 맛보세요!  
친절한 서비스와 맛있는 버거를 즐기러 오세요!",https://your-storage-path/more_photo/24164383.jpg,버거킹 판교유스페이스점,070-7462-8657,경기 성남시 분당구 삼평동 670,경기 성남시 분당구 대왕판교로 660,,
1731822411,음식점,SRID=4326;POINT(127.099933610675 37.4037932898613),"안녕하세요! 본가광양불고기입니다! 😋  
달콤한 양념과 부드러운 식감의 광양불고기! 가족 외식과 손님 접대에 최고입니다.  
맛있는 식사와 즐거운 시간을 저희 본가광양불고기에서 경험해 보세요!",https://your-storage-path/more_photo/1731822411.jpg,본가광양불고기,031-628-8066,경기 성남시 분당구 삼평동 618,경기 성남시 분당구 판교로255번길 9-22,,
1321041282,음식점,SRID=4326;POINT(127.102084009388 37.4004108231145),,https://your-storage-path/more_photo/1321041282.jpg,비스트로바이콘,031-606-8511,경기 성남시 분당구 삼평동 632,경기 성남시 분당구 대왕판교로645번길 36,,
24829272,음식점,SRID=4326;POINT(127.110550074441 37.3974046125533),"안녕하세요! 코트야드 메리어트 서울 판교 모모카페입니다 😊  
신선한 재료로 만든 맛있는 음식과 친절한 서비스가 준비되어 있어요.  
가족 외식이나 특별한 날의 모임 장소로 추천드립니다!",https://your-storage-path/more_photo/24829272.jpg,코트야드메리어트 서울판교 모모카페,031-8060-2150,경기 성남시 분당구 삼평동 664,경기 성남시 분당구 판교역로192번길 12,,
26466601,음식점,SRID=4326;POINT(127.109131752148 37.4037347007924),"안녕하세요, 이야기둘입니다! 🥩

고품질 한우를 오붓하게 즐길 수 있는 곳이에요. 맛있는 고기와 함께 조용하고 깔끔한 분위기에서 편안한 식사 경험을 즐겨보세요!",https://your-storage-path/more_photo/26466601.jpg,이야기둘,031-607-8092,경기 성남시 분당구 삼평동 691,경기 성남시 분당구 판교로319번길 13,,
1177594021,음식점,SRID=4326;POINT(127.102084009388 37.4004108231145),"안녕하세요, 하이포크입니다! 😊 
깔끔한 공간에서 맛있는 김치찌개와 두루치기를 즐겨보세요. 
주차 걱정 없이 편안하게 가족 외식, 친목 모임을 즐기실 수 있습니다!",https://your-storage-path/more_photo/1177594021.jpg,하이포크,031-606-8515,경기 성남시 분당구 삼평동 632,경기 성남시 분당구 대왕판교로645번길 36,,
19721110,음식점,SRID=4326;POINT(127.098197458293 37.4097054358725),"안녕하세요, 홍박사생고기 판교점입니다! 🥩  
신선한 소고기를 가성비 좋게 즐길 수 있는 곳!  
가족 외식이나 점심 식사로도 만족하실 거예요.",https://your-storage-path/more_photo/19721110.jpg,홍박사생고기 판교점,031-701-9700,경기 성남시 수정구 금토동 272-32,경기 성남시 수정구 달래내로 14,,
26805900,음식점,SRID=4326;POINT(127.099110789357 37.4033506803468),"안녕하세요! 스타벅스 판교브릿지타워점입니다😊  
쾌적한 공간에서 맛있는 커피와 음료를 즐겨보세요!  
친절한 직원분들이 밝은 미소로 맞이해 드립니다.",https://your-storage-path/more_photo/26805900.jpg,스타벅스 판교브릿지타워점,1522-3232,경기 성남시 분당구 삼평동 617,경기 성남시 분당구 판교로227번길 6,,
18460612,음식점,SRID=4326;POINT(127.0998760782406 37.40384559765989),"안녕하세요, 이디야커피 판교우림W시티점입니다! 😊

언제든 편하게 들러 커피 한 잔의 여유를 즐기세요!",https://your-storage-path/more_photo/18460612.jpg,이디야커피 판교우림W시티점,070-7176-5728,경기 성남시 분당구 삼평동 618,경기 성남시 분당구 판교로255번길 9-22,,
18214074,음식점,SRID=4326;POINT(127.11043380010769 37.401286319956185),"안녕하세요, 알레그리아 판교테크노밸리점입니다! ☕  
향긋하고 맛있는 커피와 함께 잠시 여유를 즐겨보세요!  
주차도 편리하고, 다양한 원두를 맛보실 수 있습니다.",https://your-storage-path/more_photo/18214074.jpg,알레그리아 판교테크노밸리점,031-696-0305,경기 성남시 분당구 삼평동 679,경기 성남시 분당구 판교역로 230,,
8373781,음식점,SRID=4326;POINT(127.100586176006 37.4044468773403),"안녕하세요, 투썸플레이스 판교만도점입니다! 😊  
세련된 인테리어와 맛있는 커피 한 잔으로 여유로운 시간을 즐겨보세요.  
편안한 공간에서 잠시 쉬어가시는 건 어떠세요?",https://your-storage-path/more_photo/8373781.jpg,투썸플레이스 판교만도점,031-698-3151,경기 성남시 분당구 삼평동 619,경기 성남시 분당구 판교로255번길 21,,
2094340913,음식점,SRID=4326;POINT(127.0952140051958 37.39961374495177),"안녕하세요, 더블테라스입니다! 🐶  
다양한 안주와 음료, 맛있는 디저트까지 즐길 수 있는 곳이에요.  
애견 동반도 가능하니, 편안하게 방문해주세요!",https://your-storage-path/more_photo/2094340913.jpg,더블테라스,,경기 성남시 분당구 판교동 512-1,경기 성남시 분당구 판교로 182-6,,
1294507468,음식점,SRID=4326;POINT(127.100089781172 37.4040238189912),"안녕하세요! 메가MGC커피 판교우림W시티점입니다😊  
다양한 음료와 디저트를 가성비 좋은 가격으로 즐기실 수 있어요.  
간단한 결제 시스템으로 편하게 방문해 보세요!",https://your-storage-path/more_photo/1294507468.jpg,메가MGC커피 판교우림W시티점,031-628-7737,경기 성남시 분당구 삼평동 618,경기 성남시 분당구 판교로255번길 9-22,,
1632127271,음식점,SRID=4326;POINT(127.101100726464 37.4024065280416),"안녕하세요, 히즈빈스 판교와디즈점입니다! 😊 
합리적인 가격의 에스프레소와 함께 편안한 시간을 즐겨보세요.
언제든 부담 없이 방문하셔서 커피 한 잔의 여유를 만끽하시길 바랍니다.",https://your-storage-path/more_photo/1632127271.jpg,히즈빈스 판교와디즈점,070-5088-6096,경기 성남시 분당구 삼평동 624,경기 성남시 분당구 판교로 242,,
1419078831,음식점,SRID=4326;POINT(127.106653585542 37.4020286271464),"안녕하세요, 메가MGC커피 판교테크노밸리점입니다! 😊
친절하신 사장님 부부가 정성껏 만들어주시는 맛있는 음료를 즐겨보세요.
가성비 좋은 메뉴와 늦은 시간까지 운영하는 점도 장점입니다.",https://your-storage-path/more_photo/1419078831.jpg,메가MGC커피 판교테크노밸리점,031-707-4614,경기 성남시 분당구 삼평동 682,경기 성남시 분당구 대왕판교로 670,,
1709913839,음식점,SRID=4326;POINT(127.094946929389 37.3991850736315),"안녕하세요! 카페만월경 판교점입니다😊  
깔끔하고 예쁜 공간에서 로스팅 전문 커피를 즐겨보세요!  
친절한 서비스와 함께 편안한 시간을 보내실 수 있습니다.",https://your-storage-path/more_photo/1709913839.jpg,카페만월경 판교점,,경기 성남시 분당구 판교동 513,경기 성남시 분당구 서판교로 147,,
1705971541,음식점,SRID=4326;POINT(127.099213061178 37.4029658587927),"안녕하세요, 히글리입니다! 😊
신선한 재료로 만든 브런치와 맛있는 커피를 즐길 수 있는 곳이에요.
음악도 좋고 분위기도 좋아 편안한 시간을 보내실 수 있을 거예요!",https://your-storage-path/more_photo/1705971541.jpg,히글리,,경기 성남시 분당구 삼평동 617,경기 성남시 분당구 판교로227번길 6,,
1940078288,음식점,SRID=4326;POINT(127.100087522272 37.4040238209119),"안녕하세요, 카페두레브입니다! 🥐  
다양한 종류의 빵과 브런치를 맛볼 수 있는 베이커리 카페입니다.  
경기지역화폐, 제로페이, 카카오페이 결제도 가능하니 편하게 방문해주세요!",https://your-storage-path/more_photo/1940078288.jpg,카페두레브,,경기 성남시 분당구 삼평동 618,경기 성남시 분당구 판교로255번길 9-22,,
1702979109,음식점,SRID=4326;POINT(127.1072085990955 37.40077120123289),"안녕하세요! 아이스걸크림보이 판교점입니다! 🍦
부드러운 아이스크림과 신선한 재료로 만든 젤라또의 환상적인 맛! 
주차도 편하고 사장님도 친절하셔서 기분 좋게 방문하실 수 있어요!",https://your-storage-path/more_photo/1702979109.jpg,아이스걸크림보이 판교점,031-724-2539,경기 성남시 분당구 삼평동 670,경기 성남시 분당구 대왕판교로 660,,
1645929273,음식점,SRID=4326;POINT(127.10751533238164 37.40123675049536),"안녕하세요, 스타벅스 판교유스페이스점입니다! ☕
친절한 직원분들이 맛있는 커피를 내려주는 곳!
회사 근처에서 잠시 여유를 즐기기에도 좋답니다.",https://your-storage-path/more_photo/1645929273.jpg,스타벅스 판교유스페이스점,1522-3232,경기 성남시 분당구 삼평동 670,경기 성남시 분당구 대왕판교로 660,,
1757208432,음식점,SRID=4326;POINT(127.09981003838598 37.404296163629695),"안녕하세요! 빽다방 판교우림w시티점입니다 😊  
다양한 편의시설과 넉넉한 주차 공간으로 편안하게 이용하실 수 있어요.  
언제든 편하게 방문해주세요!",https://your-storage-path/more_photo/1757208432.jpg,빽다방 판교우림w시티점,031-628-8954,경기 성남시 분당구 삼평동 618,경기 성남시 분당구 판교로255번길 9-22,,
21339034,음식점,SRID=4326;POINT(127.10851032513396 37.40200801634317),"안녕하세요, 투썸플레이스 판교테크노밸리점입니다😊  
넓은 매장에서 친절한 직원분들이 맛있는 음료와 디저트를 제공합니다.  
편안한 분위기에서 잠시 휴식을 취해보세요!",https://your-storage-path/more_photo/21339034.jpg,투썸플레이스 판교테크노밸리점,031-696-7777,경기 성남시 분당구 삼평동 681,경기 성남시 분당구 판교역로 235,,
578340122,음식점,SRID=4326;POINT(127.100087522272 37.4040238209119),"안녕하세요! 우지커피 판교우림W시티점입니다😊

아침 식사도 가능한 곳으로, 근처에서 아메리카노를 저렴하게 즐길 수 있어요!",https://your-storage-path/more_photo/578340122.jpg,우지커피 판교우림W시티점,031-628-8336,경기 성남시 분당구 삼평동 618,경기 성남시 분당구 판교로255번길 9-22,,
570312962,음식점,SRID=4326;POINT(127.10207492533482 37.40037479011799),"안녕하세요, 카페보나파르트입니다! 😊 
넓고 좋은 분위기에서 맛있는 커피 한 잔의 여유를 즐겨보세요.
주차도 가능하니 편하게 방문해주세요!",,카페보나파르트,031-606-8512,경기 성남시 분당구 삼평동 632,경기 성남시 분당구 대왕판교로645번길 36,,
1794225840,음식점,SRID=4326;POINT(127.09977656855632 37.40375648064768),"안녕하세요! 이오오입니다😊  
맛있는 커피와 싱글 오리진, 시원한 수박 주스까지!  
테라스에서 즐기는 여유로운 시간을 만끽해 보세요!",https://your-storage-path/more_photo/1794225840.jpg,이오오,,경기 성남시 분당구 삼평동 618,경기 성남시 분당구 판교로255번길 9-22,,
26814381,음식점,SRID=4326;POINT(127.094801471083 37.4002655146704),"안녕하세요, 싸이프러스입니다! 갤러리 구경도 하고 맛있는 빙수도 즐기러 오세요! 🍧
분위기 좋은 공간에서 시원한 시간을 보내실 수 있습니다.",https://your-storage-path/more_photo/26814381.jpg,싸이프러스,070-8220-6610,경기 성남시 분당구 판교동 497,경기 성남시 분당구 서판교로 160,,
26924590,음식점,SRID=4326;POINT(127.10722459013644 37.40010443124005),"안녕하세요! 빽다방 판교유스페이스점입니다 😊  
시원하고 맛있는 음료와 함께 편안하게 쉬어가세요!  
주차도 가능하고, 제로페이, 카카오페이 결제도 가능하답니다!",https://your-storage-path/more_photo/26924590.jpg,빽다방 판교유스페이스점,031-628-1789,경기 성남시 분당구 삼평동 670,경기 성남시 분당구 대왕판교로 660,,
17127061,음식점,SRID=4326;POINT(127.10894179597794 37.401249861157744),"안녕하세요! 스타벅스 판교H스퀘어점입니다 😊  
다양한 음료와 맛있는 빵을 즐길 수 있는 곳!  
교통이 편리하고 넓고 쾌적한 공간에서 편안하게 시간을 보내세요.",https://your-storage-path/more_photo/17127061.jpg,스타벅스 판교H스퀘어점,1522-3232,경기 성남시 분당구 삼평동 680,경기 성남시 분당구 판교역로 231,,
1360313152,음식점,SRID=4326;POINT(127.09997422647533 37.40375991776904),"안녕하세요, 매머드커피 판교우림W시티점입니다! 😊  
맛있는 스무디와 스타벅스보다 맛있는 커피를 경험해 보세요!  
친절한 사장님이 반갑게 맞이해 드립니다!",https://your-storage-path/more_photo/1360313152.jpg,매머드커피 판교우림W시티점,031-628-8334,경기 성남시 분당구 삼평동 618,경기 성남시 분당구 판교로255번길 9-22,,
27106013,음식점,SRID=4326;POINT(127.10739670550193 37.40200092388336),"안녕하세요, 나따오비까 판교점입니다! 😊
다양한 종류의 타르트와 함께 달콤한 시간을 즐겨보세요!
편안하게 주차하시고, 맛있는 타르트를 포장해서 가시는 것도 좋답니다.",https://your-storage-path/more_photo/27106013.jpg,나따오비까 판교점,031-739-8331,경기 성남시 분당구 삼평동 682,경기 성남시 분당구 대왕판교로 670,,
19336931,음식점,SRID=4326;POINT(127.106614070179 37.4028359772628),"안녕하세요, 할리스 동판교M타워점입니다! 😥 
맛있는 딸기 스무디와 친절한 사장님을 찾으신다면, 지금 바로 방문해보세요.
편리한 주차 시설과 결제 시스템도 갖춰져 있답니다!",https://your-storage-path/more_photo/19336931.jpg,할리스 동판교M타워점,031-8017-7557,경기 성남시 분당구 삼평동 684,경기 성남시 분당구 판교역로241번길 22,,
1807914706,음식점,SRID=4326;POINT(127.09958211801428 37.40276281890007),"안녕하세요, 파이드파이퍼입니다! 😊  
맛있는 커피와 크로플, 마카롱을 즐길 수 있는 곳이에요. 사장님의 친절함과 세심한 서비스에 감동하실 거예요!  
편안하게 쉬어가세요!",https://your-storage-path/more_photo/1807914706.jpg,파이드파이퍼,,경기 성남시 분당구 삼평동 617,경기 성남시 분당구 판교로227번길 6,,
809050977,음식점,SRID=4326;POINT(127.100089781173 37.4040238189997),"안녕하세요, 블루샥 판교우림W시티점입니다! 😃
시원하고 맛있는 크림 커피 한 잔 어떠세요?
경기지역화폐로 간편하게 결제하세요!",https://your-storage-path/more_photo/809050977.jpg,블루샥 판교우림W시티점,031-628-8120,경기 성남시 분당구 삼평동 618,경기 성남시 분당구 판교로255번길 9-22,,
26805871,음식점,SRID=4326;POINT(127.10742068955716 37.40218741338368),"안녕하세요, 그라비티입니다! 😊
로스팅 전문 카페에서 신선하고 맛있는 커피와 수제 에이드의 황홀한 맛을 경험해 보세요. 
친절한 사장님과 함께 편안하고 즐거운 시간을 보내실 수 있습니다.",https://your-storage-path/more_photo/26805871.jpg,그라비티,031-739-8700,경기 성남시 분당구 삼평동 682,경기 성남시 분당구 대왕판교로 670,,
1705655041,음식점,SRID=4326;POINT(127.100087522272 37.4040238209119),"안녕하세요, 텐퍼센트커피 판교우림w시티점입니다! 😊  
빠르게 테이크 아웃해서 즐기기 좋은 곳!  
편리한 주차와 와이파이, 그리고 배달까지 가능하니 편하게 이용해 보세요!",https://your-storage-path/more_photo/1705655041.jpg,텐퍼센트커피 판교우림w시티점,031-628-8775,경기 성남시 분당구 삼평동 618,경기 성남시 분당구 판교로255번길 9-22,,
801150195,음식점,SRID=4326;POINT(127.100604430957 37.4054289739225),"안녕하세요! 255카페입니다 😊  
넓고 쾌적한 공간에서 진한 커피 한 잔의 여유를 즐겨보세요!  
친절한 사장님과 편리한 주차 시설이 준비되어 있습니다.",https://your-storage-path/more_photo/801150195.jpg,255카페,,경기 성남시 분당구 삼평동 612-2,경기 성남시 분당구 판교로255번길 28,,
1421111685,음식점,SRID=4326;POINT(127.100089781173 37.4040238189997),"안녕하세요, 오프입니다! 😴  
저렴한 가격으로 꿀잠과 맛있는 드립 커피를 즐길 수 있는 곳이에요.  
편안한 휴식을 원하시는 분들께 강력 추천합니다!",https://your-storage-path/more_photo/1421111685.jpg,오프,010-8465-8141,경기 성남시 분당구 삼평동 618,경기 성남시 분당구 판교로255번길 9-22,,
27076123,음식점,SRID=4326;POINT(127.111335926617 37.3972849404131),"안녕하세요, 스타벅스 판교역로점입니다! ☕  
친절한 직원분들이 맛있는 커피와 음료를 정성껏 만들어 드립니다.  
아늑하고 쾌적한 공간에서 편안한 시간 보내세요!",https://your-storage-path/more_photo/27076123.jpg,스타벅스 판교역로점,1522-3232,경기 성남시 분당구 삼평동 663,경기 성남시 분당구 판교역로192번길 14,,
237526815,음식점,SRID=4326;POINT(127.09987720649248 37.4038446956864),"안녕하세요! 커피코트 판교우림W-CITY점입니다. ☕️
따뜻한 라떼 한 잔으로 잠시나마 여유를 느껴보세요.
부담 없는 가격으로 즐길 수 있는 커피와 함께 편안한 시간을 보내시길 바랍니다!",https://your-storage-path/more_photo/237526815.jpg,커피코트 판교우림W-CITY점,031-628-8119,경기 성남시 분당구 삼평동 618,경기 성남시 분당구 판교로255번길 9-22,,
1330348639,음식점,SRID=4326;POINT(127.0999790854492 37.40401670448944),"안녕하세요, 파츠커피입니다! 🤩  
친절한 직원분들과 차분한 분위기 속에서 맛있는 커피 한 잔 어떠세요?  
세련된 인테리어와 함께 편안한 시간을 즐겨보세요!",https://your-storage-path/more_photo/1330348639.jpg,파츠커피,031-628-8799,경기 성남시 분당구 삼평동 618,경기 성남시 분당구 판교로255번길 9-22,,
19660680,음식점,SRID=4326;POINT(127.10682616301104 37.40187079272404),"안녕하세요! 공차 판교테크노밸리점입니다 😊  
맛있는 펄과 음료, 친절한 서비스로 고객님들을 맞이하고 있습니다.  
언제든 편하게 방문해주세요!",https://your-storage-path/more_photo/19660680.jpg,공차 판교테크노밸리점,031-628-6050,경기 성남시 분당구 삼평동 682,경기 성남시 분당구 대왕판교로 670,,
