id,place_category,location,description,image_url,name,phone,lot_address,road_address,created_at,updated_at
850551920,편의점,SRID=4326;POINT(127.08535394581848 37.4061230389687),"안녕하세요, IGA마트 판교이노베이션랩점입니다! 😊  
언제든 편리하게 이용 가능한 IGA마트에서 즐거운 쇼핑 경험을 누려보세요!  
카카오페이 결제도 가능하니, 더욱 간편하게 이용하실 수 있습니다.",https://your-storage-path/more_photo/850551920.jpg,IGA마트 판교이노베이션랩점,,경기 성남시 수정구 금토동 713,경기 성남시 수정구 금토로80번길 11,,
27498628,편의점,SRID=4326;POINT(127.10462826563588 37.42214028341419),"안녕하세요! GS25 성남시흥점입니다 😊  
경기지역화폐, 카카오페이 등 다양한 결제 수단으로 편리하게 이용하세요!  
포스트박스 서비스도 이용 가능하답니다.",https://your-storage-path/more_photo/27498628.jpg,GS25 성남시흥점,,경기 성남시 수정구 시흥동 200-4,경기 성남시 수정구 여수대로 24,,
22484458,음식점,SRID=4326;POINT(127.1132502408866 37.39507652074782),"삿뽀로 판교점입니다! 🍣  
신선한 회와 맛있는 일본 요리, 깔끔한 공간에서 즐겨보세요.  
친절한 서비스와 편안한 룸에서 소중한 분들과의 모임을 가져보세요!",https://your-storage-path/more_photo/22484458.jpg,삿뽀로 판교점,031-8016-5990,경기 성남시 분당구 삼평동 741,경기 성남시 분당구 대왕판교로606번길 58,,
976327217,음식점,SRID=4326;POINT(127.11067093990792 37.3943491352585),"안녕하세요! 신도세기 판교역점입니다. 😊  
신선한 돼지고기의 풍미와 맛있는 밑반찬, 든든한 식사 메뉴까지!  
친절한 서비스와 쾌적한 공간에서 즐거운 식사 경험을 선사해 드립니다.",https://your-storage-path/more_photo/976327217.jpg,신도세기 판교역점,031-622-7188,경기 성남시 분당구 백현동 537,경기 성남시 분당구 판교역로 152,,
556505866,음식점,SRID=4326;POINT(127.110267983777 37.3921771476804),"안녕하세요, 숙성도 판교점입니다! 😊  
숙성된 풍미 가득한 흑돼지와 목살, 맛있는 김치찌개까지!  
친절한 직원들이 최고의 식사를 선사해 드립니다.",https://your-storage-path/more_photo/556505866.jpg,숙성도 판교점,031-8023-9233,경기 성남시 분당구 백현동 540,경기 성남시 분당구 판교역로 136,,
555051094,음식점,SRID=4326;POINT(127.111978256492 37.3857152081619),"안녕하세요, 파파라구입니다! 😊  
신선한 재료로 만든 풍성한 맛의 이탈리안 음식들을 맛보세요! 훌륭한 서비스와 함께 즐거운 식사 경험을 선사해 드릴게요.",https://your-storage-path/more_photo/555051094.jpg,파파라구,031-709-5624,경기 성남시 분당구 백현동 562-4,경기 성남시 분당구 판교역로10번길 22-3,,
27478057,음식점,SRID=4326;POINT(127.112093995302 37.3845762051616),"안녕하세요! 서울멸치쌈밥입니다😊  
입맛 돋우는 멸치쌈밥과 멸치회무침의 환상적인 조합!  
푸짐한 양과 친절함으로, 가족, 친구와 함께 방문하셔서 맛있는 식사 경험을 즐겨보세요!",https://your-storage-path/more_photo/27478057.jpg,서울멸치쌈밥,031-8017-3999,경기 성남시 분당구 백현동 580-7,경기 성남시 분당구 판교역로10번길 10-3,,
1876658997,음식점,SRID=4326;POINT(127.11054127228884 37.39448711288341),"안녕하세요, 제이스팟 알파돔타워입니다! 😊  
신선한 야채와 고기의 환상적인 조화, 잊을 수 없는 육수의 풍미를 즐겨보세요.  
깔끔하고 고급스러운 공간에서 최고의 맛을 경험하세요!",https://your-storage-path/more_photo/1876658997.jpg,제이스팟 알파돔타워,031-622-7179,경기 성남시 분당구 백현동 537,경기 성남시 분당구 판교역로 152,,
18553912,음식점,SRID=4326;POINT(127.11242459424771 37.394242962451976),"안녕하세요, 방유당 그레이츠판교점입니다! 🍽️

정갈한 한식과 건강한 식재료로 격조 높은 식사를 선사합니다.

상견례, 가족 모임, 돌잔치 등 특별한 날을 위한 완벽한 선택, 방유당에서 소중한 분들과 즐거운 시간을 만들어보세요!",https://your-storage-path/more_photo/18553912.jpg,방유당 그레이츠판교점,031-706-0690,경기 성남시 분당구 백현동 535,경기 성남시 분당구 분당내곡로 117,,
1228192888,음식점,SRID=4326;POINT(127.11044189327458 37.39448720574311),"안녕하세요! 사위식당 판교점입니다😊  
푸짐한 낙곱새와 맛있는 곁들임 메뉴까지!  
가성비 좋은 식사와 친절한 서비스로 즐거운 식사 경험을 선사해 드릴게요!",https://your-storage-path/more_photo/1228192888.jpg,사위식당 판교점,031-622-7180,경기 성남시 분당구 백현동 537,경기 성남시 분당구 판교역로 152,,
1726447229,음식점,SRID=4326;POINT(127.111678879291 37.38409455041481),"안녕하세요, 다이호시입니다! 🍣  
신선한 숙성회와 다채로운 구성의 카이센동의 환상적인 맛을 경험해 보세요!  
차분한 분위기 속에서 특별한 식사를 즐기실 수 있습니다.",https://your-storage-path/more_photo/1726447229.jpg,다이호시,031-705-8322,경기 성남시 분당구 백현동 581-9,경기 성남시 분당구 판교역로10번길 6,,
1814498690,음식점,SRID=4326;POINT(127.10878554267666 37.39394452394362),"안녕하세요! 차고145입니다😊 판교 데이트, 특별한 날을 위한 최고의 선택!  
입에서 살살 녹는 1++ 한우와 맛있는 밑반찬의 완벽한 조화, 잊지 못할 경험을 선사해 드립니다.  
콜키지 프리 서비스도 제공하니, 소중한 사람들과 와인 한 잔 즐기며 행복한 시간 보내세요!",https://your-storage-path/more_photo/1814498690.jpg,차고145,031-781-1450,경기 성남시 분당구 백현동 530,경기 성남시 분당구 판교역로 145,,
1421266432,음식점,SRID=4326;POINT(127.10909102792868 37.39434069213597),"안녕하세요! 어글리스토브 판교라스트리트점입니다😊  
맛있는 음식과 친절한 서비스, 쾌적한 공간에서 즐거운 식사 경험을 선사해 드립니다.  
친구, 연인과 함께 방문하셔서 행복한 시간 보내세요!",https://your-storage-path/more_photo/1421266432.jpg,어글리스토브 판교라스트리트점,031-706-8459,경기 성남시 분당구 백현동 530,경기 성남시 분당구 판교역로 145,,
1349313781,음식점,SRID=4326;POINT(127.11160922845754 37.3957610554216),"안녕하세요, 몽중헌 판교점입니다! 😊
몽중헌의 맛있는 딤섬과 탕수육, 칠리새우를 경험해보세요.
친절한 서비스와 함께, 특별한 날의 식사를 즐겨보세요!",https://your-storage-path/more_photo/1349313781.jpg,몽중헌 판교점,031-601-7574,경기 성남시 분당구 백현동 534,경기 성남시 분당구 분당내곡로 131,,
1430452993,음식점,SRID=4326;POINT(127.11237361553552 37.39413578931001),"안녕하세요! 푸에르코 판교점입니다.😊
고기 맛은 물론, 룸 형태의 아늑하고 편안한 공간에서 식사하실 수 있어요! 
친절한 서비스와 콜키지 프리 혜택까지 누려보세요~",https://your-storage-path/more_photo/1430452993.jpg,푸에르코 판교점,031-622-7501,경기 성남시 분당구 백현동 535,경기 성남시 분당구 분당내곡로 117,,
1732093108,음식점,SRID=4326;POINT(127.11059209242654 37.394487966386606),"안녕하세요! 광화문국밥 판교점입니다😊  
신선하고 정갈한 반찬과 깔끔하고 맛있는 돼지국밥, 수육의 환상적인 조합을 즐겨보세요!  
판교에서 가성비 좋은 든든한 한 끼 식사를 경험해 보세요!",https://your-storage-path/more_photo/1732093108.jpg,광화문국밥 판교점,031-622-7170,경기 성남시 분당구 백현동 537,경기 성남시 분당구 판교역로 152,,
26945095,음식점,SRID=4326;POINT(127.11171635464537 37.39337054347198),"안녕하세요, 신승반점 현대백화점판교점입니다! 😄 
웨이팅은 기본이지만, 맛있는 유니짜장과 찹쌀탕수육을 맛보세요!
분당판교 최고의 중식 맛집에서 특별한 식사를 즐겨보세요!",https://your-storage-path/more_photo/26945095.jpg,신승반점 현대백화점판교점,031-5170-1051,경기 성남시 분당구 백현동 541,경기 성남시 분당구 판교역로146번길 20,,
46564381,음식점,SRID=4326;POINT(127.10913600296132 37.3957624629289),"안녕하세요, 자산어보 판교직영점입니다! 🌊
신선한 해산물과 정갈한 회 코스를 맛보세요.
친절한 서비스와 넉넉한 주차 공간까지, 편안한 식사를 즐기실 수 있습니다!",https://your-storage-path/more_photo/46564381.jpg,자산어보 판교직영점,031-706-9880,경기 성남시 분당구 백현동 531,경기 성남시 분당구 대왕판교로606번길 10,,
27351405,음식점,SRID=4326;POINT(127.111791423442 37.3967727304957),"안녕하세요, 동청담 삼평직영점입니다! 🍜
판교 최고의 짜장면과 맛있는 중식 요리를 맛보세요.
점심 식사, 회식, 친목 모임에도 안성맞춤입니다!",https://your-storage-path/more_photo/27351405.jpg,동청담 삼평직영점,031-705-7777,경기 성남시 분당구 삼평동 653,경기 성남시 분당구 대왕판교로606번길 45,,
22484388,음식점,SRID=4326;POINT(127.11332478521938 37.39508275648251),"안녕하세요, 경복궁 판교점입니다! 👨‍🍳
정갈하고 맛있는 음식과 룸으로 이루어진 아늑한 공간에서 가족, 지인들과의 소중한 시간을 만들어보세요.
친절한 서비스와 편리한 접근성으로 편안한 식사를 즐기실 수 있습니다.",https://your-storage-path/more_photo/22484388.jpg,경복궁 판교점,031-8016-8038,경기 성남시 분당구 삼평동 741,경기 성남시 분당구 대왕판교로606번길 58,,
1174471186,음식점,SRID=4326;POINT(127.10860972435576 37.39418886249133),"안녕하세요! 쉐누하누입니다! 😊\
최상급 한우의 풍미와 멋진 분위기, 친절한 서비스까지! 특별한 날, 잊지 못할 경험을 선사해 드릴게요.\",https://your-storage-path/more_photo/1174471186.jpg,쉐누하누,031-703-5530,경기 성남시 분당구 백현동 530,경기 성남시 분당구 판교역로 145,,
960695295,음식점,SRID=4326;POINT(127.11016007668611 37.3932927135856),"안녕하세요, 앤디쉬 그래비티 서울 판교입니다! 😊
신선한 해산물과 고급 레스토랑 퀄리티의 맛있는 음식들을 즐겨보세요.
기념일이나 특별한 날, 잊지 못할 경험을 선사해 드립니다.",https://your-storage-path/more_photo/960695295.jpg,앤디쉬 그래비티 서울 판교,031-539-4820,경기 성남시 분당구 백현동 538,경기 성남시 분당구 판교역로146번길 2,,
91157184,음식점,SRID=4326;POINT(127.1121278443362 37.38607547566592),"안녕하세요, 리스카페입니다! 😊  
따뜻하고 포근한 분위기에서 맛있는 미국 가정식 브런치를 즐겨보세요.  
다양한 메뉴와 넉넉한 양으로, 특별한 날을 더욱 특별하게 만들어 드립니다!",https://your-storage-path/more_photo/91157184.jpg,리스카페,010-6654-6300,경기 성남시 분당구 백현동 561-3,경기 성남시 분당구 판교역로2번길 29,,
1452199841,음식점,SRID=4326;POINT(127.10926379848912 37.39433152240114),"안녕하세요! 송추가마골 인어반 판교점입니다 😊
맛있는 갈비와 함께 점심 식사 어떠세요? 친절한 서비스와 넓고 깔끔한 공간에서 즐거운 식사 경험을 선사해 드릴게요!",https://your-storage-path/more_photo/1452199841.jpg,송추가마골 인어반 판교점,031-705-8503,경기 성남시 분당구 백현동 530,경기 성남시 분당구 판교역로 145,,
1763923315,음식점,SRID=4326;POINT(127.108725461476 37.3953501732047),"안녕하세요! 돈블랑 판교점입니다. 😊  
고소한 풍미 가득한 돼지고기와 맛있는 밑반찬, 그리고 직원들의 친절함까지!  
편안하고 깔끔한 공간에서 즐거운 식사 경험을 만끽하세요!",https://your-storage-path/more_photo/1763923315.jpg,돈블랑 판교점,031-703-7722,경기 성남시 분당구 백현동 531,경기 성남시 분당구 대왕판교로606번길 10,,
652267180,음식점,SRID=4326;POINT(127.11034542140034 37.39415932385902),"안녕하세요, 카츠쇼쿠도우 판교본점입니다! 😊
부드러운 등심 돈까스와 든든한 카레의 환상적인 조합!
맛있는 점심 식사, 혼밥, 회식 모두 저희 카츠쇼쿠도우에서 즐겨보세요!",https://your-storage-path/more_photo/652267180.jpg,카츠쇼쿠도우 판교본점,031-622-7134,경기 성남시 분당구 백현동 537,경기 성남시 분당구 판교역로 152,,
1048838366,음식점,SRID=4326;POINT(127.111809653518 37.39688083583213),"안녕하세요! 얼룩도야지입니다! 🐷  
 신선한 고기와 맛있는 김치찌개로 든든한 식사 어떠세요?  
 회식 장소로도 좋고, 정육 식당이라 고기 품질도 믿을 수 있답니다!",https://your-storage-path/more_photo/1048838366.jpg,얼룩도야지,031-8017-2840,경기 성남시 분당구 삼평동 653,경기 성남시 분당구 대왕판교로606번길 45,,
26945306,음식점,SRID=4326;POINT(127.112254219211 37.392071661309885),"안녕하세요, 봉우리 현대백화점 판교점입니다! 👨‍🍳
정갈하고 고급스러운 한정식, 맛깔나는 보리굴비와 부드러운 갈비찜! 
룸도 준비되어 있어 가족 모임, 상견례에도 좋습니다.",https://your-storage-path/more_photo/26945306.jpg,봉우리 현대백화점 판교점,031-5170-1936,경기 성남시 분당구 백현동 541,경기 성남시 분당구 판교역로146번길 20,,
737486428,음식점,SRID=4326;POINT(127.109308940451 37.3950883389784),"안녕하세요, 매드포갈릭 판교라스트리트점입니다! 😊
맛있는 음식과 친절한 서비스, 편안한 주차까지! 소중한 사람들과 즐거운 시간을 보내세요.
가족, 친구, 연인과 함께 방문하기 좋은 곳입니다.",https://your-storage-path/more_photo/737486428.jpg,매드포갈릭 판교라스트리트점,031-703-8920,경기 성남시 분당구 백현동 132-208,경기 성남시 분당구 대왕판교로606번길 10,,
26628252,음식점,SRID=4326;POINT(127.11073544438928 37.397510759621525),"안녕하세요! 라디오베이입니다 😄 
판교 최고 맛집으로 손꼽히는 저희 가게에서 부드러운 폭립과 맛있는 콥샐러드를 즐겨보세요! 
피맥하기 좋은 힙한 분위기에서 즐거운 시간 보내세요!",https://your-storage-path/more_photo/26628252.jpg,라디오베이,031-8061-0773,경기 성남시 분당구 삼평동 664,경기 성남시 분당구 판교역로192번길 12,,
27178420,음식점,SRID=4326;POINT(127.11262854893292 37.39771620649867),"안녕하세요! 이가네양꼬치 판교본점입니다! 😊 
쫄깃한 왕양꼬치와 부드러운 양갈비의 환상적인 조합!  
맛있는 음식과 함께 즐거운 시간을 보내세요!",https://your-storage-path/more_photo/27178420.jpg,이가네양꼬치 판교본점,0507-1359-9688,경기 성남시 분당구 삼평동 657,경기 성남시 분당구 분당내곡로 155,,
27375644,음식점,SRID=4326;POINT(127.112076234534 37.3847816553057),"안녕하세요! 리얼스페인 판교점입니다 🇪🇸
다양한 메뉴와 풍성한 양, 맛있는 음식에 직원들의 친절함까지!
데이트는 물론, 점심 식사 장소로도 강력 추천합니다!",https://your-storage-path/more_photo/27375644.jpg,리얼스페인 판교점,031-8017-3614,경기 성남시 분당구 백현동 580-2,경기 성남시 분당구 판교역로10번길 12-5,,
1607284381,음식점,SRID=4326;POINT(127.11208127204128 37.39271695719322),"안녕하세요! JS가든 판교점입니다! 🥢  
최고급 중식 파인다이닝을 경험할 수 있는 곳! 맛있는 요리와 함께 특별한 날을 기념해보세요.  
깔끔하고 프라이빗한 공간에서 잊지 못할 추억을 만들어 보세요!",https://your-storage-path/more_photo/1607284381.jpg,js가든 판교점,031-5170-1957,경기 성남시 분당구 백현동 541,경기 성남시 분당구 판교역로146번길 20,,
13100819,음식점,SRID=4326;POINT(127.112491792826 37.3847992812104),"안녕하세요! 최고집짬뽕입니다! 🍜  
싱싱한 해물이 가득한 짬뽕과 든든한 볶음밥, 탕수육의 환상적인 조합!  
언제나 맛있는 식사로 여러분을 맞이하겠습니다.",https://your-storage-path/more_photo/13100819.jpg,최고집짬뽕,,경기 성남시 분당구 백현동 580-4,경기 성남시 분당구 판교역로10번길 12-9,,
106771056,음식점,SRID=4326;POINT(127.11219774095396 37.398122976651166),"안녕하세요! 진1926 판교점입니다! 🥩  
신선하고 맛있는 양고기와 함께 즐거운 시간을 보내보세요!  
친절한 서비스와 고급스러운 분위기 속에서 특별한 경험을 만끽하세요.",https://your-storage-path/more_photo/106771056.jpg,진1926 판교점,031-707-0292,경기 성남시 분당구 삼평동 659,경기 성남시 분당구 판교역로192번길 22,,
21608198,음식점,SRID=4326;POINT(127.11324022886244 37.39517744476525),"안녕하세요! 맥도날드 동판교점입니다! 😊
빠르고 친절한 서비스와 넓고 쾌적한 공간에서 맛있는 식사 어떠세요?
가성비 좋은 런치 메뉴와 24시간 운영으로 언제든 편하게 방문하세요!",https://your-storage-path/more_photo/21608198.jpg,맥도날드 동판교점,031-606-4000,경기 성남시 분당구 삼평동 741,경기 성남시 분당구 대왕판교로606번길 58,,
19613273,음식점,SRID=4326;POINT(127.111487029983 37.3864545112087),"안녕하세요, 블레도르 백현카페거리점입니다! 🍰  
쫀득하고 맛있는 빵과, 특히 밀푀유 케이크와 초코 케이크가 일품인 곳이에요!  
친절한 사장님 덕분에 맛있는 케이크를 맛보며 기분 좋은 시간을 보내실 수 있을 거예요!",https://your-storage-path/more_photo/19613273.jpg,블레도르 백현카페거리점,031-704-7228,경기 성남시 분당구 백현동 560,경기 성남시 분당구 판교역로2번길 40,,
27517572,음식점,SRID=4326;POINT(127.11249187537746 37.393167979334855),"안녕하세요, 이탈리 판교점입니다! 🇮🇹
이탈리아 본토의 맛을 그대로 재현한, 속 편안한 진짜 이탈리안 요리를 맛보세요.
풍성한 맛의 파스타와 라자냐, 와인 한 잔과 함께 즐거운 식사 경험을 선사해 드립니다.",https://your-storage-path/more_photo/27517572.jpg,이탈리 판교점,031-5170-1061,경기 성남시 분당구 백현동 541,경기 성남시 분당구 판교역로146번길 20,,
388514220,음식점,SRID=4326;POINT(127.113825859695 37.3858936488655),"안녕하세요! 메이크어케이크 백현동본점입니다 🥰  
입에서 사르르 녹는 맛있는 수제 케이크와 부드러운 아메리카노의 환상적인 조합!  
친절한 서비스와 함께 특별한 날을 더욱 달콤하게 만들어보세요!",https://your-storage-path/more_photo/388514220.jpg,메이크어케이크 백현동본점,031-709-7040,경기 성남시 분당구 백현동 588-1,경기 성남시 분당구 동판교로52번길 21-6,,
21657018,음식점,SRID=4326;POINT(127.11378103382458 37.39657981620823),"안녕하세요, 세시셀라 아브뉴프랑점입니다! 🍰  
계속 생각나는 당근 케이크와 맛있는 음료가 있는 곳이에요.  
분위기 좋은 공간에서 즐거운 시간 보내세요!",https://your-storage-path/more_photo/21657018.jpg,세시셀라 아브뉴프랑점,,경기 성남시 분당구 삼평동 740,경기 성남시 분당구 동판교로177번길 25,,
725464277,음식점,SRID=4326;POINT(127.115370815573 37.3875230032731),"안녕하세요, 무궁화파이브입니다! 💖  
따뜻한 분위기 속에서 맛있는 브런치와 훌륭한 파스타를 즐겨보세요.  
친절한 직원분들과 함께 특별한 시간을 만들어보세요!",https://your-storage-path/more_photo/725464277.jpg,무궁화파이브,031-705-3367,경기 성남시 분당구 백현동 603-2,경기 성남시 분당구 동판교로52번길 9-9,,
977779113,음식점,SRID=4326;POINT(127.11524165045984 37.38650046821303),"안녕하세요, 올덴브라운입니다! ☕  
이국적인 분위기에서 맛있는 커피와 케이크를 즐겨보세요. 힙하고 따뜻한 공간에서 소중한 사람들과 잊지 못할 추억을 만드세요!",https://your-storage-path/more_photo/977779113.jpg,올덴브라운,,경기 성남시 분당구 백현동 592-4,경기 성남시 분당구 동판교로52번길 17-7,,
1909759002,음식점,SRID=4326;POINT(127.112747352962 37.3842917617163),"안녕하세요, 크래킹커피 판교백현점입니다! 😊  
겉바속촉의 프렌치토스트와 시그니처 크래킹 라떼의 환상적인 조합!  
아이와 함께, 혹은 연인과 함께 방문하셔서 행복한 시간을 만들어 보세요!",https://your-storage-path/more_photo/1909759002.jpg,크래킹커피 판교백현점,031-697-8699,경기 성남시 분당구 백현동 583-2,경기 성남시 분당구 판교역로2번길 10,,
1303358665,음식점,SRID=4326;POINT(127.11196392127104 37.39581748446897),"안녕하세요, 알레그리아 판교테크원점입니다! ☕

고소하고 맛있는 라떼와 향긋한 드립 커피의 완벽한 조화! 
판교 테크원 빌딩에 위치해 접근성도 좋으니, 편하게 방문해 보세요!",https://your-storage-path/more_photo/1303358665.jpg,알레그리아 판교테크원점,031-601-7587,경기 성남시 분당구 백현동 534,경기 성남시 분당구 분당내곡로 131,,
1939739739,음식점,SRID=4326;POINT(127.114523242272 37.3870823259198),"안녕하세요, 카페 악토버입니다! 🥐
맛있는 빵과 신선한 재료로 만든 브런치를 북유럽풍의 아늑한 공간에서 즐겨보세요.  
친절한 서비스와 멋진 분위기까지, 악토버에서 특별한 경험을 만끽하세요.",https://your-storage-path/more_photo/1939739739.jpg,카페 악토버,,경기 성남시 분당구 백현동 605,경기 성남시 분당구 동판교로52번길 9,,
590977772,음식점,SRID=4326;POINT(127.1119242419006 37.39419568294326),"안녕하세요! 카페마마스 판교점입니다 😊  
신선한 재료로 만든 샐러드와 샌드위치, 그리고 시그니처 메뉴까지!  
브런치와 함께 여유로운 시간을 즐겨보세요.",https://your-storage-path/more_photo/590977772.jpg,카페마마스 판교점,031-622-7545,경기 성남시 분당구 백현동 535,경기 성남시 분당구 분당내곡로 117,,
13138198,음식점,SRID=4326;POINT(127.1110102608982 37.38628376534207),"안녕하세요, 레디쉬브라운 판교본점입니다! 😌  
부드러운 우유 얼음과 직접 만든 팥의 조화가 일품인 팥빙수와 향긋한 드립 커피를 즐겨보세요.  
차분한 분위기 속에서 편안하게 책을 읽거나, 여유로운 시간을 보내시길 바랍니다.",https://your-storage-path/more_photo/13138198.jpg,레디쉬브라운 판교본점,,경기 성남시 분당구 백현동 565,경기 성남시 분당구 판교역로18번길 30,,
1737095608,음식점,SRID=4326;POINT(127.11161156059232 37.39581060940837),"안녕하세요, 투썸플레이스 판교알파돔점입니다! 😌
넓고 쾌적한 공간에서 다양한 음료와 디저트를 즐겨보세요.
늦은 시간까지 운영하니, 언제든 편안하게 방문해주세요!",https://your-storage-path/more_photo/1737095608.jpg,투썸플레이스 판교알파돔점,031-601-7575,경기 성남시 분당구 백현동 534,경기 성남시 분당구 분당내곡로 131,,
882531039,음식점,SRID=4326;POINT(127.1134100356646 37.39769743912406),"안녕하세요, 메이크어케이크 아브뉴프랑판교점입니다! 🍰
신선한 과일과 부드러운 크림의 조화가 일품인 케이크와 맛있는 음료를 맛보세요.
친절한 서비스와 함께, 특별한 날을 더욱 특별하게 만들어 드립니다!",https://your-storage-path/more_photo/882531039.jpg,메이크어케이크 아브뉴프랑판교점,031-708-7040,경기 성남시 분당구 삼평동 740,경기 성남시 분당구 동판교로177번길 25,,
127079691,음식점,SRID=4326;POINT(127.11077836489564 37.39521221352414),"안녕하세요, 펠트커피 카카오판교아지트입니다! ☕  
고품질의 커피와 맛있는 치즈케이크, 디카페인 라떼까지!  
편안하고 분위기 좋은 공간에서 커피 한 잔의 여유를 즐겨보세요.",https://your-storage-path/more_photo/127079691.jpg,펠트커피 카카오판교아지트,070-5172-5955,경기 성남시 분당구 백현동 532,경기 성남시 분당구 판교역로 166,,
1841364911,음식점,SRID=4326;POINT(127.11345442618766 37.39717750723127),"안녕하세요, 스타벅스 판교아비뉴프랑R점입니다! ☕

친절한 직원분들이 만들어주는 맛있는 커피와 넓고 쾌적한 공간에서 여유로운 시간을 즐겨보세요. 😊

언제나 기분 좋은 에너지를 얻어 가실 수 있도록 최선을 다하겠습니다!",https://your-storage-path/more_photo/1841364911.jpg,스타벅스 판교아비뉴프랑R점,1522-3232,경기 성남시 분당구 삼평동 740,경기 성남시 분당구 동판교로177번길 25,,
