id,place_category,location,description,image_url,name,phone,lot_address,road_address,created_at,updated_at
1812550076,음식점,SRID=4326;POINT(127.12189055037555 37.38664697585504),"안녕하세요! 미가 본점입니다😊  
고소하고 부드러운 들깨수제비와 감칠맛 나는 충무김밥의 환상적인 조화!  
친절한 서비스와 맛있는 음식으로 여러분을 맞이하겠습니다.",https://your-storage-path/more_photo/1812550076.jpg,미가 본점,031-8016-3832,경기 성남시 분당구 서현동 260-3,경기 성남시 분당구 황새울로335번길 10,,
2118186042,음식점,SRID=4326;POINT(127.121329456762 37.3839147497361),"안녕하세요! 교대이층집 서현점입니다! 😃
고기 맛은 물론이고, 친절한 직원분들이 직접 구워주는 맛있는 삼겹살과 항정살!
점심에는 한식 뷔페도 즐길 수 있으니, 언제든 편하게 방문해 주세요!",https://your-storage-path/more_photo/2118186042.jpg,교대이층집 서현점,031-702-2222,경기 성남시 분당구 서현동 269-6,경기 성남시 분당구 분당로53번길 9,,
571177381,카페,SRID=4326;POINT(127.125293964668 37.3859883752454),"안녕하세요! 벌툰 몽유도원 서현역점입니다! 📚

편안한 공간에서 카카오페이, 제로페이로 간편하게 결제하시고 즐거운 시간 보내세요~",https://your-storage-path/more_photo/571177381.jpg,벌툰 몽유도원 서현역점,031-707-0248,경기 성남시 분당구 서현동 247-2,경기 성남시 분당구 황새울로360번길 24,,
347099623,기타,SRID=4326;POINT(127.1244967629285 37.38667129155043),"안녕하세요! 토즈 모임센터 분당서현점입니다😊  
깔끔하고 조용한 공간에서 편안하게 스터디, 회의를 즐겨보세요!  
친절한 서비스와 쾌적한 환경을 제공해 드립니다.",https://your-storage-path/more_photo/347099623.jpg,토즈모임센터 분당서현점,031-706-0116,경기 성남시 분당구 서현동 249-3,경기 성남시 분당구 황새울로342번길 21,,
620893242,음식점,SRID=4326;POINT(127.12427421897 37.3866147611847),"안녕하세요! 굿웨더입니다 😊  
맛있는 디저트와 음료, 감성적인 분위기까지!  
편안하게 쉬어가실 수 있는 공간을 제공해 드립니다.",https://your-storage-path/more_photo/620893242.jpg,굿웨더,0507-1372-2331,경기 성남시 분당구 서현동 249-4,경기 성남시 분당구 황새울로342번길 19,,
2049900741,음식점,SRID=4326;POINT(127.12041399770294 37.38479688616825),"안녕하세요, 어반스피릿입니다! 🌆
분위기 좋은 공간에서 맛있는 커피와 음료를 즐겨보세요.
데이트 코스로도 제격이니, 어반스피릿에서 특별한 시간을 만들어보세요.",https://your-storage-path/more_photo/2049900741.jpg,어반스피릿,031-709-2288,경기 성남시 분당구 서현동 273-2,경기 성남시 분당구 황새울로 315,,
107494195,음식점,SRID=4326;POINT(127.11713650646549 37.39017928419497),"안녕하세요, 메가MGC커피 판교백현화랑초점입니다! ☕ 
제로페이, 카카오페이 모두 가능하며 편리하게 이용하실 수 있습니다. 
언제나 편안한 방문 되시길 바랍니다!",https://your-storage-path/more_photo/107494195.jpg,메가MGC커피 판교백현화랑초점,031-705-3457,경기 성남시 분당구 백현동 546,경기 성남시 분당구 동판교로 92,,
2071896518,음식점,SRID=4326;POINT(127.122390699039 37.3949313590773),"안녕하세요! 스타벅스 분당이매점입니다😊  
넓고 쾌적한 공간에서 다양한 음료와 함께 편안한 시간을 즐겨보세요!  
카공족들을 위한 넓은 테이블과 콘센트도 준비되어 있답니다.",https://your-storage-path/more_photo/2071896518.jpg,스타벅스 분당이매점,1522-3232,경기 성남시 분당구 이매동 146-2,경기 성남시 분당구 이매로 15,,
1316492798,음식점,SRID=4326;POINT(127.1223572541719 37.38616624867342),안녕하세요! 투썸플레이스 서현중앙점입니다😊 넓고 쾌적한 공간에서 맛있는 커피와 함께 편안한 시간을 즐겨보세요! 친절한 직원분들과 함께 기분 좋은 시간을 보내실 수 있습니다.,https://your-storage-path/more_photo/1316492798.jpg,투썸플레이스 서현중앙점,031-706-0055,경기 성남시 분당구 서현동 260-6,경기 성남시 분당구 황새울로 337,,
7977696,음식점,SRID=4326;POINT(127.12336635483034 37.38799607867603),"안녕하세요, 스타벅스 서현미래에셋점입니다! ☕  
친절한 직원분들과 맛있는 커피, 쾌적한 공간에서 즐거운 시간 보내세요.  
가족 모임으로도 좋고, 편안하게 책 읽기에도 좋은 곳입니다.",https://your-storage-path/more_photo/7977696.jpg,스타벅스 서현미래에셋,1522-3232,경기 성남시 분당구 서현동 254-1,경기 성남시 분당구 황새울로359번길 11,,
738485748,음식점,SRID=4326;POINT(127.125939695243 37.3858921808979),"안녕하세요, 랑데자뷰 서현점입니다! 😊 
넓고 예쁜 공간에서 맛있는 흑임자 라떼와 랑데자뷰를 즐겨보세요. 
애견 동반도 가능하니, 편안하게 방문해주세요!",https://your-storage-path/more_photo/738485748.jpg,랑데자뷰 서현점,031-709-3740,경기 성남시 분당구 서현동 246-1,경기 성남시 분당구 황새울로360번길 19,,
1842073793,음식점,SRID=4326;POINT(127.1154230040465 37.38841946998597),"안녕하세요! 메가MGC커피 성남백현마을점입니다 😊
친절한 직원분들이 만들어주는 맛있는 커피와 다양한 메뉴들을 즐겨보세요!
편안한 분위기 속에서 즐거운 시간을 보내실 수 있도록 노력하겠습니다!",https://your-storage-path/more_photo/1842073793.jpg,메가MGC커피 성남백현마을점,031-708-7888,경기 성남시 분당구 백현동 550,경기 성남시 분당구 동판교로 61,,
17127082,음식점,SRID=4326;POINT(127.124051888619 37.3860022990184),"안녕하세요, 스타벅스 서현역점입니다! 🌟  
다양한 커피와 음료를 즐기며, 넓고 쾌적한 공간에서 편안한 시간을 보내세요.  
친절한 직원분들이 항상 여러분을 맞이합니다!",https://your-storage-path/more_photo/17127082.jpg,스타벅스 서현역,1522-3232,경기 성남시 분당구 서현동 248-5,경기 성남시 분당구 서현로210번길 20,,
1202799047,음식점,SRID=4326;POINT(127.11510435857404 37.38828462717269),"안녕하세요, 컴포즈커피 판교백현점입니다! 😊
가성비 좋은 커피와 함께 편안하게 휴식 취해보세요.
포장도 가능하니 테이크 아웃도 즐겨보세요!",https://your-storage-path/more_photo/1202799047.jpg,컴포즈커피 판교백현점,031-8016-9144,경기 성남시 분당구 백현동 551,경기 성남시 분당구 동판교로 59,,
24765607,음식점,SRID=4326;POINT(127.12012032465516 37.38403221607528),"안녕하세요! 스타벅스 분당구청점입니다. 💖

음료 제조가 빨라서 좋고, 직원분들이 정말 친절해서 기분 좋게 방문하실 수 있어요.
조용하고 아늑한 분위기에서 맛있는 커피와 함께 여유를 즐겨보세요!",https://your-storage-path/more_photo/24765607.jpg,스타벅스 분당구청점,1522-3232,경기 성남시 분당구 서현동 267-3,경기 성남시 분당구 분당로 43,,
2006097686,음식점,SRID=4326;POINT(127.114441706133 37.385442542937),"안녕하세요, 백금당 판교입니다! 😌  
백금당만의 특별한 케이크와 커피를 즐기며, 편안한 시간을 보내세요.  
주차 걱정 없이, 사랑하는 반려견과 함께 방문하셔도 좋습니다!",https://your-storage-path/more_photo/2006097686.jpg,백금당 판교,010-5446-9438,경기 성남시 분당구 백현동 587-4,경기 성남시 분당구 동판교로52번길 19-12,,
24868735,음식점,SRID=4326;POINT(127.1259036866122 37.38596700414746),"안녕하세요, 스타벅스 서현점입니다! ☕

친절한 직원분들과 함께 맛있는 커피를 즐길 수 있는 곳이에요.  
매장이 시끄럽지 않고 조용해서 편안하게 시간을 보내실 수 있답니다!",https://your-storage-path/more_photo/24868735.jpg,스타벅스 서현점,1522-3232,경기 성남시 분당구 서현동 246-1,경기 성남시 분당구 황새울로360번길 19,,
1045139053,음식점,SRID=4326;POINT(127.12241693901731 37.38398300782759),"안녕하세요, 투썸플레이스 서현로데오점입니다! 😊  
넓고 쾌적한 공간에서 맛있는 커피와 디저트를 즐겨보세요.  
친절한 직원들이 항상 여러분을 맞이합니다!",https://your-storage-path/more_photo/1045139053.jpg,투썸플레이스 서현로데오점,031-701-5334,경기 성남시 분당구 서현동 268-3,경기 성남시 분당구 분당로53번길 16,,
1171245130,음식점,SRID=4326;POINT(127.115051729283 37.3870971303271),"안녕하세요! 미더스입니다😊  
다채로운 메뉴와 맛있는 커피, 예쁜 공간에서 브런치를 즐겨보세요!  
애견 동반도 가능하니, 편안하게 방문해주세요!",https://your-storage-path/more_photo/1171245130.jpg,미더스,,경기 성남시 분당구 백현동 605-3,경기 성남시 분당구 동판교로52번길 9-6,,
936069801,편의점,SRID=4326;POINT(127.12405907367705 37.38830710783242),"안녕하세요! GS25 분당에클라트점입니다. 
다양한 결제 수단으로 편리하게 이용하실 수 있어요! 
깔끔한 매장에서 필요한 물품을 편하게 쇼핑하세요 😊",https://your-storage-path/more_photo/936069801.jpg,GS25 분당에클라트점,031-724-4645,경기 성남시 분당구 서현동 251-3,경기 성남시 분당구 서현로 184,,
1038747808,편의점,SRID=4326;POINT(127.12079661252136 37.38539387431541),"안녕하세요! CU 서현텍스타워점입니다! 😊  
카카오페이와 제로페이 결제가 가능하여 편리하게 이용하실 수 있습니다.  
언제든 편하게 방문해주세요!",https://your-storage-path/more_photo/1038747808.jpg,CU 서현텍스타워점,,경기 성남시 분당구 서현동 272-3,경기 성남시 분당구 황새울로319번길 6,,
12315328,편의점,SRID=4326;POINT(127.12283775222691 37.38929950760345),"안녕하세요! GS25 분당아이원점입니다! 😊  
친절한 직원분들이 언제나 밝게 맞아주시는 곳!  
편리한 결제 시스템으로 편안하게 이용하세요!",https://your-storage-path/more_photo/12315328.jpg,GS25 분당아이원점,031-783-5520,경기 성남시 분당구 서현동 255-1,경기 성남시 분당구 서현로 170,,
17892738,편의점,SRID=4326;POINT(127.122862586418 37.3879101049626),"안녕하세요, CU 서현으뜸점입니다! 😊 
친절한 사장님이 반겨주는 곳! 편의점 택배와 간편 결제도 가능하니, 언제든 편하게 들러주세요!",https://your-storage-path/more_photo/17892738.jpg,CU 서현으뜸점,031-709-0927,경기 성남시 분당구 서현동 254-5,경기 성남시 분당구 서현로180번길 13,,
12314871,편의점,SRID=4326;POINT(127.11982047690968 37.38435058148429),"안녕하세요! GS25 분당시그마점입니다😊  
친절한 서비스로 고객님들을 맞이하고 있습니다.  
다양한 결제 수단으로 편리하게 이용하세요!",https://your-storage-path/more_photo/12314871.jpg,GS25 분당시그마점,,경기 성남시 분당구 서현동 276-1,경기 성남시 분당구 황새울로 307,,
1658333772,편의점,SRID=4326;POINT(127.12049918180594 37.38722415541122),"안녕하세요! GS25 R분당4점입니다! 😊  
카카오페이, 제로페이 결제가 가능하여 편리하게 이용하실 수 있습니다.  
언제든 편하게 들러주세요!",https://your-storage-path/more_photo/1658333772.jpg,GS25 R분당4점,,경기 성남시 분당구 서현동 259-2,경기 성남시 분당구 황새울로311번길 37,,
25757521,편의점,SRID=4326;POINT(127.12233495550215 37.38703665987519),"안녕하세요! GS25 분당서현CGV점입니다😊  
친절한 직원분들이 반갑게 맞이해 드립니다!  
편리한 결제 시스템과 다양한 편의시설을 이용해 보세요!",https://your-storage-path/more_photo/25757521.jpg,GS25 분당서현CGV점,,경기 성남시 분당구 서현동 256,경기 성남시 분당구 서현로180번길 19,,
2127775956,편의점,SRID=4326;POINT(127.121777889845 37.3882031582909),"안녕하세요! GS25 분당제생병원점입니다 😊  
친절한 서비스와 편리한 결제 시스템으로 언제나 즐거운 쇼핑 경험을 선사해 드려요!  
언제든 편하게 들러주세요!",https://your-storage-path/more_photo/2127775956.jpg,GS25 분당제생병원점,,경기 성남시 분당구 서현동 255-2,경기 성남시 분당구 서현로180번길 20,,
707536536,편의점,SRID=4326;POINT(127.120990388431 37.386524460114),"안녕하세요! 이마트24 서현진성호텔점입니다😊  
넓고 깨끗한 매장에서 편리하게 쇼핑하세요! 주차도 가능합니다.",https://your-storage-path/more_photo/707536536.jpg,이마트24 서현진성호텔점,031-705-1520,경기 성남시 분당구 서현동 261-1,경기 성남시 분당구 황새울로311번길 36,,
12314924,편의점,SRID=4326;POINT(127.124787617663 37.3857023853183),"안녕하세요, GS25 분당서현점입니다! 😄  
친절한 서비스로 편안하게 이용하실 수 있도록 노력하고 있습니다.  
언제든 부담 없이 방문해주세요!",https://your-storage-path/more_photo/12314924.jpg,GS25 분당서현점,031-703-5959,경기 성남시 분당구 서현동 247-4,경기 성남시 분당구 황새울로360번길 28,,
669035237,편의점,SRID=4326;POINT(127.122396626063 37.3846849259699),"안녕하세요, CU 분당서현역점입니다. 😥
고객님들께 최고의 서비스를 제공해드리지 못해 죄송한 마음입니다.
더욱 친절하고 쾌적한 환경을 만들기 위해 노력하겠습니다.",https://your-storage-path/more_photo/669035237.jpg,CU 분당서현역점,,경기 성남시 분당구 서현동 269-1,경기 성남시 분당구 분당로53번길 21,,
8013131,편의점,SRID=4326;POINT(127.122272571397 37.3861699403532),"안녕하세요, GS25 분당웰빙점입니다! 😊 
다양한 결제 수단으로 편리하게 이용하실 수 있습니다. 
편안하게 필요한 물건들을 찾아보세요!",https://your-storage-path/more_photo/8013131.jpg,GS25 분당웰빙점,031-706-9211,경기 성남시 분당구 서현동 260-6,경기 성남시 분당구 황새울로 337,,
723209375,편의점,SRID=4326;POINT(127.121889184773 37.3948706076251),"안녕하세요, GS25 분당아름점입니다! 😊
다양한 물건과 편의시설을 갖춰, 편리하게 이용하실 수 있습니다.
언제든 편안하게 방문해주세요!",https://your-storage-path/more_photo/723209375.jpg,GS25 분당아름점,,경기 성남시 분당구 이매동 142,경기 성남시 분당구 이매로 11,,
708925484,편의점,SRID=4326;POINT(127.12288623993808 37.38925710916912),"안녕하세요! CU 서현아이원점입니다 😊 

언제든 편리하게 이용하실 수 있는 저희 CU 서현아이원점에서 간편하게 필요한 물건들을 만나보세요!",https://your-storage-path/more_photo/708925484.jpg,CU 서현아이원점,031-701-7802,경기 성남시 분당구 서현동 255-1,경기 성남시 분당구 서현로 170,,
502169247,편의점,SRID=4326;POINT(127.121459286916 37.3832010059456),"안녕하세요! GS25 분당퍼스트점입니다 😊  
친절한 사장님과 숙달된 계산원분들이 항상 밝게 맞이해 드립니다.  
다양한 결제 수단과 스마트한 서비스까지! 편하게 이용하세요!",https://your-storage-path/more_photo/502169247.jpg,GS25 분당퍼스트점,,경기 성남시 분당구 서현동 266-1,경기 성남시 분당구 분당로 55,,
7955004,편의점,SRID=4326;POINT(127.121696564649 37.3846964607277),"안녕하세요! 세븐일레븐 서현점입니다 😊 
편리한 결제 시스템과 함께, 언제든 편안하게 이용하실 수 있도록 준비되어 있습니다. 
언제든 편하게 들러주세요!",https://your-storage-path/more_photo/7955004.jpg,세븐일레븐 서현점,,경기 성남시 분당구 서현동 270-3,경기 성남시 분당구 황새울로330번길 16,,
1380123124,편의점,SRID=4326;POINT(127.12421990049744 37.386543637445456),"안녕하세요! 세븐일레븐 서현그린점입니다😊 
다양한 상품들을 편리하게 만나보세요!
카카오페이, 제로페이 결제도 가능합니다.",https://your-storage-path/more_photo/1380123124.jpg,세븐일레븐 서현그린점,1577-0711,경기 성남시 분당구 서현동 249-4,경기 성남시 분당구 황새울로342번길 19,,
79967130,편의점,SRID=4326;POINT(127.12452713107488 37.38796422726855),"안녕하세요! 세븐일레븐 서현3점입니다😊  
카카오페이, 제로페이 결제 가능하며, 언제든 편하게 이용하세요!  
고객님들께 편리함을 제공해 드리기 위해 항상 노력하겠습니다.",https://your-storage-path/more_photo/79967130.jpg,세븐일레븐 서현3점,1577-0711,경기 성남시 분당구 서현동 251-1,경기 성남시 분당구 서현로 192,,
16514866,편의점,SRID=4326;POINT(127.121396920938 37.3837380799267),"안녕하세요! CU 분당서현점입니다. 😊 
저희 편의점은 다양한 결제 수단과 택배 서비스를 제공하여 편리함을 추구합니다. 
언제든 편안하게 이용하세요!",https://your-storage-path/more_photo/16514866.jpg,CU 분당서현점,031-781-8988,경기 성남시 분당구 서현동 269-6,경기 성남시 분당구 분당로53번길 9,,
222174541,편의점,SRID=4326;POINT(127.120574369109 37.3869312463467),"안녕하세요, GS25 R분당3점입니다! 😊 
언제든 편리하게 이용하실 수 있는 편의점입니다. 
다양한 결제 수단으로 간편하게 결제하세요!",https://your-storage-path/more_photo/222174541.jpg,GS25 R분당3점,,경기 성남시 분당구 서현동 259-1,경기 성남시 분당구 황새울로311번길 37,,
313445862,편의점,SRID=4326;POINT(127.12374447027324 37.38857954628725),"안녕하세요! 세븐일레븐 서현에클라트점입니다😊  
친절한 서비스로 언제나 기분 좋게 방문하실 수 있도록 노력하고 있어요.  
언제든 편하게 들러주세요!",https://your-storage-path/more_photo/313445862.jpg,세븐일레븐 서현에클라트점,,경기 성남시 분당구 서현동 251-3,경기 성남시 분당구 서현로 184,,
15229989,문화시설,SRID=4326;POINT(127.129543286097 37.4012056586716),"안녕하세요, 성남큐브미술관입니다! 🎨 
다양한 미술 작품을 감상하며, 아이들과 즐거운 시간을 보내세요!
주차도 편리하고, 편안하게 전시를 관람하실 수 있습니다.",https://your-storage-path/more_photo/15229989.jpg,성남큐브미술관,031-783-8141,경기 성남시 분당구 야탑동 757,경기 성남시 분당구 성남대로 808,,
7940504,문화시설,SRID=4326;POINT(127.13096361465828 37.40288359621435),"안녕하세요, 성남아트센터입니다! 🎭  
다양한 공연과 전시를 즐길 수 있는 문화 예술 공간입니다.  
분당의 랜드마크에서 특별한 경험을 만끽하세요!",https://your-storage-path/more_photo/7940504.jpg,성남아트센터,031-783-8000,경기 성남시 분당구 야탑동 757,경기 성남시 분당구 성남대로 808,,
26303946,문화시설,SRID=4326;POINT(127.130540177642 37.4029417297631),"안녕하세요, 성남아트센터 오페라하우스입니다! 🎭

다양한 공연과 전시가 열리는 멋진 문화 공간에서 잊지 못할 추억을 만들어보세요! 
가족, 연인, 친구와 함께 즐거운 시간을 보내시길 바랍니다.",https://your-storage-path/more_photo/26303946.jpg,성남아트센터 오페라하우스,031-783-8000,경기 성남시 분당구 야탑동 757,경기 성남시 분당구 성남대로 808,,
20709494,문화시설,SRID=4326;POINT(127.12953351536083 37.40143452860773),"안녕하세요! 성남미디어센터입니다😊
다양한 문화 예술을 즐길 수 있는 멋진 공간에서 특별한 경험을 만들어보세요!
언제든 편안하게 방문하셔서 즐거운 시간 보내시길 바랍니다.",https://your-storage-path/more_photo/20709494.jpg,성남미디어센터,031-724-8370,경기 성남시 분당구 야탑동 757,경기 성남시 분당구 성남대로 808,,
18059986,문화시설,SRID=4326;POINT(127.132076933942 37.4033544924815),"안녕하세요, 성남아트센터 콘서트홀입니다! 🎭
클래식, 뮤지컬, 오페라 등 다채로운 공연을 즐길 수 있는 문화예술 공간입니다.
편안한 공연 관람을 위해 최선을 다하겠습니다.",https://your-storage-path/more_photo/18059986.jpg,성남아트센터 콘서트홀,031-783-8000,경기 성남시 분당구 야탑동 757,경기 성남시 분당구 성남대로 808,,
7987128,문화시설,SRID=4326;POINT(127.130638773128 37.4024839025188),"안녕하세요, 성남아트센터 앙상블시어터입니다! 🎭
아이들과 함께 즐거운 시간을 보낼 수 있는 공연들이 가득하답니다.
좋은 위치와 주변 자연환경 덕분에 아이들과 행복한 추억을 만들 수 있어요!",https://your-storage-path/more_photo/7987128.jpg,성남아트센터 앙상블시어터,031-783-8000,경기 성남시 분당구 야탑동 757,경기 성남시 분당구 성남대로 808,,
27266829,문화시설,SRID=4326;POINT(127.129529838671 37.4012669428052),"안녕하세요, 성남아트센터 미디어홀입니다! 🎭
품격 있는 문화예술 공간에서 특별한 경험을 즐겨보세요.
다양한 공연과 전시로 여러분을 맞이하겠습니다.",,성남아트센터 미디어홀,031-783-8000,경기 성남시 분당구 야탑동 757,경기 성남시 분당구 성남대로 808,,
843528174,문화시설,SRID=4326;POINT(127.130545856069 37.4029597439006),"안녕하세요, 성남아트센터 갤러리808입니다! 🖼️
다양한 전시를 통해 풍부한 예술적 경험을 선사하는 곳입니다.
편안하게 작품을 감상하며 문화생활을 즐겨보세요!",https://your-storage-path/more_photo/843528174.jpg,성남아트센터 갤러리808,,경기 성남시 분당구 야탑동 757,경기 성남시 분당구 성남대로 808,,
1924405937,문화시설,SRID=4326;POINT(127.13126260611884 37.402706664679286),"안녕하세요! 성남아트센터 컨퍼런스홀입니다 😊
품격 있는 문화 예술 공연을 즐길 수 있는 곳!
편안한 관람 환경을 제공합니다.",,성남아트센터 컨퍼런스홀,031-783-8296,경기 성남시 분당구 야탑동 757,경기 성남시 분당구 성남대로 808,,
17570579,문화시설,SRID=4326;POINT(127.130494962821 37.4029201551849),"안녕하세요! 성남아트센터 춤의광장입니다! 💃
모두가 함께 즐길 수 있는 문화예술 공간에서 특별한 경험을 만들어보세요!
다양한 공연과 전시가 여러분을 기다리고 있답니다!",,성남아트센터 춤의광장,,경기 성남시 분당구 야탑동 757,경기 성남시 분당구 성남대로 808,,
968456940,음식점,SRID=4326;POINT(127.11349306688658 37.39808750166581),"안녕하세요, 우테이블입니다! 🥩  
최상급 한우의 풍미를 경험할 수 있는 곳! 특별한 날, 소중한 분들과 함께 최고의 식사를 즐겨보세요.  
맛있는 고기와 친절한 서비스로 여러분을 맞이하겠습니다!",https://your-storage-path/more_photo/968456940.jpg,우테이블,031-703-4775,경기 성남시 분당구 삼평동 740,경기 성남시 분당구 동판교로177번길 25,,
21800518,음식점,SRID=4326;POINT(127.113531369941 37.397275644709),"안녕하세요, 스시혼 판교본점입니다🍣  
신선한 재료로 만든 맛있는 스시와 오마카세를 가성비 있게 즐겨보세요!  
친절한 서비스와 룸도 마련되어 있어 편안한 식사 가능합니다.",https://your-storage-path/more_photo/21800518.jpg,스시혼 판교본점,,경기 성남시 분당구 삼평동 740,경기 성남시 분당구 동판교로177번길 25,,
369744461,음식점,SRID=4326;POINT(127.1125454336824 37.39726667599204),"안녕하세요! 양재정육식당입니다! 😊  
음식도 빨리 나오고, 친절한 직원분들이 고기를 구워주셔서 편하게 드실 수 있어요.  
맛있는 고기와 든든한 식사를 가성비 좋게 즐겨보세요!",https://your-storage-path/more_photo/369744461.jpg,양재정육식당,031-708-5705,경기 성남시 분당구 삼평동 656,경기 성남시 분당구 분당내곡로 151,,
1615267371,음식점,SRID=4326;POINT(127.11379448635805 37.39800792209731),"안녕하세요! 담솥 판교아브뉴프랑점입니다😊  
신선한 재료로 정성껏 지은 솥밥과 깔끔한 밑반찬의 조화! 든든하고 건강한 한 끼 식사를 즐겨보세요.  
맛있는 솥밥 드시고, 기분 좋은 하루 되세요!",https://your-storage-path/more_photo/1615267371.jpg,담솥 판교아브뉴프랑점,0507-1342-9553,경기 성남시 분당구 삼평동 740,경기 성남시 분당구 동판교로177번길 25,,
1465537638,음식점,SRID=4326;POINT(127.113404877456 37.3972721620053),"안녕하세요, 양바위 본점입니다! 😋
신선한 재료로 정성껏 준비한 특양구이와 대창구이를 맛보세요!
주차도 가능하고, 콜키지프리 서비스도 제공하고 있으니 편안하게 즐기세요!",https://your-storage-path/more_photo/1465537638.jpg,양바위 본점,031-706-9288,경기 성남시 분당구 삼평동 740,경기 성남시 분당구 동판교로177번길 25,,
